{
  "schemaVersion": "learning-companion.lesson-model.v1",
  "session": {
    "id": "2026-08-09-day-001-session-01",
    "planId": "enterprise-ai-transformation-runtime",
    "day": 1,
    "topic": "企业 AI 系统分层",
    "mode": "text",
    "depth": "medium",
    "status": "preparing"
  },
  "theme": "systems-engineering",
  "question": "模型很强，为什么系统仍然可能不可靠？",
  "requiredTerms": ["企业 AI 系统分层", "模型能力", "系统能力", "Authoritative State"],
  "decks": [
    {
      "id": "system-layers",
      "title": "企业 AI 系统分层主课件",
      "sectionIds": ["core-concept", "runtime-flow", "authority-layers", "system-boundaries", "delivery-timeline"]
    }
  ],
  "sections": [
    {
      "id": "core-concept",
      "type": "concept",
      "title": "模型能力不等于系统能力",
      "summary": "模型负责推理，系统负责事实、状态、流程、风险和结果。",
      "sourceRefs": ["dashboard.md#Today"]
    },
    {
      "id": "runtime-flow",
      "type": "flow",
      "title": "可靠交付保障链",
      "summary": "建议经过证据、流程和治理后成为可靠交付。",
      "nodes": [
        {"id": "model", "label": "模型建议", "kind": "neutral"},
        {"id": "evidence", "label": "知识与证据", "kind": "success"},
        {"id": "workflow", "label": "流程与工具", "kind": "active"},
        {"id": "human", "label": "人类门禁", "kind": "gate"}
      ],
      "edges": [
        {"from": "model", "to": "evidence", "label": "核对"},
        {"from": "evidence", "to": "workflow", "label": "执行"},
        {"from": "workflow", "to": "human", "label": "验收"}
      ],
      "sourceRefs": [
        "enterprise-ai-transformation-runtime-learning-plan-v4-preview.zh.md#Day-1"
      ]
    },
    {
      "id": "authority-layers",
      "type": "layer-map",
      "title": "权威状态分层",
      "summary": "状态由记录层托底，再由流程层和体验层使用。",
      "nodes": [
        {"id": "record", "label": "Authoritative State", "kind": "success"},
        {"id": "workflow-layer", "label": "流程编排", "kind": "active"},
        {"id": "experience", "label": "业务体验", "kind": "neutral"}
      ],
      "edges": [
        {"from": "record", "to": "workflow-layer", "label": "提供事实"},
        {"from": "workflow-layer", "to": "experience", "label": "呈现结果"}
      ],
      "sourceRefs": ["dashboard.md#Today"]
    },
    {
      "id": "system-boundaries",
      "type": "boundary-map",
      "title": "系统边界与门禁",
      "summary": "模型输出跨越工具边界时必须经过风险门禁。",
      "nodes": [
        {"id": "assistant", "label": "模型输出", "kind": "neutral"},
        {"id": "gateway", "label": "工具网关", "kind": "gate"},
        {"id": "review", "label": "风险复核", "kind": "risk"}
      ],
      "edges": [
        {"from": "assistant", "to": "gateway", "label": "请求工具"},
        {"from": "gateway", "to": "review", "label": "触发复核"}
      ],
      "sourceRefs": ["dashboard.md#Today"]
    },
    {
      "id": "delivery-timeline",
      "type": "timeline",
      "title": "可靠交付时间线",
      "summary": "交付按证据、执行和验收的顺序推进。",
      "nodes": [
        {"id": "prepare", "label": "准备证据", "kind": "success"},
        {"id": "operate", "label": "执行变更", "kind": "active"},
        {"id": "accept", "label": "完成验收", "kind": "gate"}
      ],
      "edges": [
        {"from": "prepare", "to": "operate", "label": "进入执行"},
        {"from": "operate", "to": "accept", "label": "提交验收"}
      ],
      "sourceRefs": ["dashboard.md#Today"]
    }
  ]
}
